Active code page: 1252

C:\Program Files\PostgreSQL\8.2\bin>psql -U postgres
Password for user postgres:
Welcome to psql 8.2.5, the PostgreSQL interactive terminal.

Type:  \copyright for distribution terms
       \h for help with SQL commands
       \? for help with psql commands
       \g or terminate with semicolon to execute query
       \q to quit

postgres=# \c iqbalfauzi_14650013;
You are now connected to database "iqbalfauzi_14650013".
iqbalfauzi_14650013=# \d
            List of relations
 Schema |     Name     | Type  |  Owner
--------+--------------+-------+----------
 public | fakultas     | table | postgres
 public | gaji         | table | postgres
 public | identitasnim | table | postgres
 public | mahasiswa    | table | postgres
(4 rows)

iqbalfauzi_14650013=# select * from mahasiswa;
 nim_mah | nama_mah | alamat_mah |  nomor_telp  | id_fak
---------+----------+------------+--------------+--------
      14 | luki     | ponorogo   | 085275658789 |      2
(1 row)

iqbalfauzi_14650013=# alter table add column "gender" varchar(1);
ERROR:  syntax error at or near "column"
LINE 1: alter table add column "gender" varchar(1);
                        ^
iqbalfauzi_14650013=# alter table MAHASISWA add column "gender" varchar(1);
ALTER TABLE
iqbalfauzi_14650013=# SELECT * FROM MAHASISWA;
 nim_mah | nama_mah | alamat_mah |  nomor_telp  | id_fak | gender
---------+----------+------------+--------------+--------+--------
      14 | luki     | ponorogo   | 085275658789 |      2 |
(1 row)

iqbalfauzi_14650013=# UPDATE mahasiswa set gender='L' where nim_mah=14;
UPDATE 1
iqbalfauzi_14650013=# UPDATE mahasiswa set nim_mah=1 where nama_mah='luki';
UPDATE 1
iqbalfauzi_14650013=# select * from mahasiswa;
 nim_mah | nama_mah | alamat_mah |  nomor_telp  | id_fak | gender
---------+----------+------------+--------------+--------+--------
       1 | luki     | ponorogo   | 085275658789 |      2 | L
(1 row)

iqbalfauzi_14650013=# insert into mahasiswa values (2, 'adi' , 'malang' , '08572
332121' , 2 , 'L');
INSERT 0 1
iqbalfauzi_14650013=# SELECT * FROM MAHASISWA;
 nim_mah | nama_mah | alamat_mah |  nomor_telp  | id_fak | gender
---------+----------+------------+--------------+--------+--------
       1 | luki     | ponorogo   | 085275658789 |      2 | L
       2 | adi      | malang     | 08572332121  |      2 | L
(2 rows)

iqbalfauzi_14650013=# SELECT * FROM FAKULTAS;
 id_fak | nama_fak
--------+-----------
      2 | PSIKOLOGI
(1 row)

iqbalfauzi_14650013=# INSERT INTO fakultas values (1, 'SAINTEK');
INSERT 0 1
iqbalfauzi_14650013=# INSERT INTO fakultas values (3, 'HUMANIORA');
INSERT 0 1
iqbalfauzi_14650013=# SELECT * FROM MAHASISWA;
 nim_mah | nama_mah | alamat_mah |  nomor_telp  | id_fak | gender
---------+----------+------------+--------------+--------+--------
       1 | luki     | ponorogo   | 085275658789 |      2 | L
       2 | adi      | malang     | 08572332121  |      2 | L
(2 rows)

iqbalfauzi_14650013=# insert into mahasiswa values (3, 'atik' , 'magelang' , '08
572332121' , 1 , 'P');
INSERT 0 1
iqbalfauzi_14650013=# insert into mahasiswa values (4, 'arif' , 'solo' , '085723
32121' , 1 , 'L');
INSERT 0 1
iqbalfauzi_14650013=# insert into mahasiswa values (5, 'adam' , 'Bojonegoro' , '
08572332121' , 1 , 'L');
INSERT 0 1
iqbalfauzi_14650013=# insert into mahasiswa values (6, 'intan' , 'Bojonegoro' ,
'08572332121' , 2 , 'P');
INSERT 0 1
iqbalfauzi_14650013=# insert into mahasiswa values (6, 'melia' , 'Irian jaya' ,
'08572332121' , 1 , 'P');
INSERT 0 1
iqbalfauzi_14650013=# delete from mahasiswa where alamat_mah='bojonegoro';
DELETE 0
iqbalfauzi_14650013=# insert into mahasiswa values (7, 'melia' , 'Irian jaya' ,
'08572332121' , 1 , 'P');
INSERT 0 1
iqbalfauzi_14650013=# select * from mahasiswa;
 nim_mah | nama_mah | alamat_mah |  nomor_telp  | id_fak | gender
---------+----------+------------+--------------+--------+--------
       1 | luki     | ponorogo   | 085275658789 |      2 | L
       2 | adi      | malang     | 08572332121  |      2 | L
       3 | atik     | magelang   | 08572332121  |      1 | P
       4 | arif     | solo       | 08572332121  |      1 | L
       5 | adam     | Bojonegoro | 08572332121  |      1 | L
       6 | intan    | Bojonegoro | 08572332121  |      2 | P
       6 | melia    | Irian jaya | 08572332121  |      1 | P
       7 | melia    | Irian jaya | 08572332121  |      1 | P
(8 rows)

iqbalfauzi_14650013=# delete from mahasiswa where alamat_mah='Irian jaya';
DELETE 2
iqbalfauzi_14650013=# insert into mahasiswa values (7, 'melia' , 'Irian jaya' ,
'08572332121' , 1 , 'P');
INSERT 0 1
iqbalfauzi_14650013=# select * from mahasiswa;
 nim_mah | nama_mah | alamat_mah |  nomor_telp  | id_fak | gender
---------+----------+------------+--------------+--------+--------
       1 | luki     | ponorogo   | 085275658789 |      2 | L
       2 | adi      | malang     | 08572332121  |      2 | L
       3 | atik     | magelang   | 08572332121  |      1 | P
       4 | arif     | solo       | 08572332121  |      1 | L
       5 | adam     | Bojonegoro | 08572332121  |      1 | L
       6 | intan    | Bojonegoro | 08572332121  |      2 | P
       7 | melia    | Irian jaya | 08572332121  |      1 | P
(7 rows)

iqbalfauzi_14650013=# select nim_mah as nomor_identitas , nama_mah as nama , ala
mat_mah as alamat, id_fak as nama_fakultas from mahasiswa;
 nomor_identitas | nama  |   alamat   | nama_fakultas
-----------------+-------+------------+---------------
               1 | luki  | ponorogo   |             2
               2 | adi   | malang     |             2
               3 | atik  | magelang   |             1
               4 | arif  | solo       |             1
               5 | adam  | Bojonegoro |             1
               6 | intan | Bojonegoro |             2
               7 | melia | Irian jaya |             1
(7 rows)

iqbalfauzi_14650013=# select * from mahasiswa where id_fak='1' and gender='L';
 nim_mah | nama_mah | alamat_mah | nomor_telp  | id_fak | gender
---------+----------+------------+-------------+--------+--------
       4 | arif     | solo       | 08572332121 |      1 | L
       5 | adam     | Bojonegoro | 08572332121 |      1 | L
(2 rows)

iqbalfauzi_14650013=# select * from mahasiswa where id_fak='1' and gender='P';
 nim_mah | nama_mah | alamat_mah | nomor_telp  | id_fak | gender
---------+----------+------------+-------------+--------+--------
       3 | atik     | magelang   | 08572332121 |      1 | P
       7 | melia    | Irian jaya | 08572332121 |      1 | P
(2 rows)

iqbalfauzi_14650013=# select * from mahasiswa where id_fak='1' OR gender='L';
 nim_mah | nama_mah | alamat_mah |  nomor_telp  | id_fak | gender
---------+----------+------------+--------------+--------+--------
       1 | luki     | ponorogo   | 085275658789 |      2 | L
       2 | adi      | malang     | 08572332121  |      2 | L
       3 | atik     | magelang   | 08572332121  |      1 | P
       4 | arif     | solo       | 08572332121  |      1 | L
       5 | adam     | Bojonegoro | 08572332121  |      1 | L
       7 | melia    | Irian jaya | 08572332121  |      1 | P
(6 rows)

iqbalfauzi_14650013=# SELECT * FROM MAHASISWA where nam_mah between 3 and 5;
ERROR:  column "nam_mah" does not exist
LINE 1: SELECT * FROM MAHASISWA where nam_mah between 3 and 5;
                                      ^
iqbalfauzi_14650013=# SELECT * FROM MAHASISWA where nim_mah between 3 and 5;
 nim_mah | nama_mah | alamat_mah | nomor_telp  | id_fak | gender
---------+----------+------------+-------------+--------+--------
       3 | atik     | magelang   | 08572332121 |      1 | P
       4 | arif     | solo       | 08572332121 |      1 | L
       5 | adam     | Bojonegoro | 08572332121 |      1 | L
(3 rows)

iqbalfauzi_14650013=# SELECT * FROM MAHASISWA where nim_mah not between 3 and 5;

 nim_mah | nama_mah | alamat_mah |  nomor_telp  | id_fak | gender
---------+----------+------------+--------------+--------+--------
       1 | luki     | ponorogo   | 085275658789 |      2 | L
       2 | adi      | malang     | 08572332121  |      2 | L
       6 | intan    | Bojonegoro | 08572332121  |      2 | P
       7 | melia    | Irian jaya | 08572332121  |      1 | P
(4 rows)

iqbalfauzi_14650013=# select nim_mah,nama_mah,alamat_mah,nomor_telp,id_fak ,gend
er where nim_mah in (2,3,5);
ERROR:  column "nim_mah" does not exist
LINE 1: select nim_mah,nama_mah,alamat_mah,nomor_telp,id_fak ,gender...
               ^
iqbalfauzi_14650013=# select nama_mah,alamat_mah,nomor_telp,id_fak ,gender where
 nim_mah in (2,3,5);
ERROR:  column "nama_mah" does not exist
LINE 1: select nama_mah,alamat_mah,nomor_telp,id_fak ,gender where n...
               ^
iqbalfauzi_14650013=# select nim_mah,nama_mah,alamat_mah,nomor_telp,id_fak ,gend
er from mahasiswa where nim_mah in (2,3,5);
 nim_mah | nama_mah | alamat_mah | nomor_telp  | id_fak | gender
---------+----------+------------+-------------+--------+--------
       2 | adi      | malang     | 08572332121 |      2 | L
       3 | atik     | magelang   | 08572332121 |      1 | P
       5 | adam     | Bojonegoro | 08572332121 |      1 | L
(3 rows)

iqbalfauzi_14650013=# select * from mahasiswa where nama_mah like 'a%';
 nim_mah | nama_mah | alamat_mah | nomor_telp  | id_fak | gender
---------+----------+------------+-------------+--------+--------
       2 | adi      | malang     | 08572332121 |      2 | L
       3 | atik     | magelang   | 08572332121 |      1 | P
       4 | arif     | solo       | 08572332121 |      1 | L
       5 | adam     | Bojonegoro | 08572332121 |      1 | L
(4 rows)

iqbalfauzi_14650013=# select * from mahasiswa where nama_mah like '%a';
 nim_mah | nama_mah | alamat_mah | nomor_telp  | id_fak | gender
---------+----------+------------+-------------+--------+--------
       7 | melia    | Irian jaya | 08572332121 |      1 | P
(1 row)

iqbalfauzi_14650013=# select * from mahasiswa where nama_mah like '__%n';
 nim_mah | nama_mah | alamat_mah | nomor_telp  | id_fak | gender
---------+----------+------------+-------------+--------+--------
       6 | intan    | Bojonegoro | 08572332121 |      2 | P
(1 row)

iqbalfauzi_14650013=# select * from mahasiswa where nama_mah like '__l_a';
 nim_mah | nama_mah | alamat_mah | nomor_telp  | id_fak | gender
---------+----------+------------+-------------+--------+--------
       7 | melia    | Irian jaya | 08572332121 |      1 | P
(1 row)

iqbalfauzi_14650013=# select id_fak from mahasiswa;
 id_fak
--------
      2
      2
      1
      1
      1
      2
      1
(7 rows)

iqbalfauzi_14650013=# select distinct id_fak from mahasiswa;
 id_fak
--------
      1
      2
(2 rows)

iqbalfauzi_14650013=#